{
  "eventId": "10000000-0000-4000-8000-000000000005",
  "eventType": "AuctionExpired",
  "schemaVersion": 1,
  "aggregateId": "20000000-0000-4000-8000-000000000002",
  "sequence": 4,
  "occurredAt": "2026-09-21T16:00:00Z",
  "data": {
    "releasedInvestmentTransactionIds": [
      "investment-tx-101",
      "investment-tx-102"
    ]
  }
}
